{"schema":"geometry.step_topology.inspect.result.a0","session":{"session_handle":"gts_1111111111111111111111111111111111111111111111111111111111111111","generation":7},"counts":{"definitions":0,"root_occurrences":0,"component_occurrences":1,"bodies":0,"shells":0,"faces":0,"memberships":0},"page":{"definitions":[],"occurrences":[{"kind":"component","handle":"gtt_cccccccccccccccccccccccccccccccccccccccccccccccccccccccccccccccc","definition_handle":"gtt_aaaaaaaaaaaaaaaaaaaaaaaaaaaaaaaaaaaaaaaaaaaaaaaaaaaaaaaaaaaaaaaa","parent_occurrence_handle":"gtt_bbbbbbbbbbbbbbbbbbbbbbbbbbbbbbbbbbbbbbbbbbbbbbbbbbbbbbbbbbbbbbbb","depth":65,"name":"excessive depth","transform":[1,0,0,0,0,1,0,0,0,0,1,0]}],"bodies":[],"shells":[],"faces":[],"memberships":[]},"diagnostics":[]}
