{"schema":"geometry.step_topology.inspect.result.a0","session":{"session_handle":"gts_1111111111111111111111111111111111111111111111111111111111111111","generation":7},"counts":{"definitions":2,"root_occurrences":0,"component_occurrences":0,"bodies":0,"shells":0,"faces":0,"memberships":0},"page":{"definitions":[{"handle":"gtt_4444444444444444444444444444444444444444444444444444444444444444","name":"first page","assembly":false,"body_count":0,"face_count":0}],"occurrences":[],"bodies":[],"shells":[],"faces":[],"next_cursor":"page-2","memberships":[]},"diagnostics":[]}
